{
  "metadata": {
    "object_type": "doctrine_mesh_specification_validation_receipt",
    "trust_zone": "proposed",
    "lifecycle_status": "validated_specification_only",
    "provenance_note": "Rebound on 2026-08-28 by Codex root after a cache-free changed-input replay of twenty-one adversarial tests and independent recomputation of the exact 85-file payload. This receipt records evidence presence and internal consistency only; execution, reviewer identity, and timestamps remain unauthenticated.",
    "reason_for_inclusion": "Bind deterministic final validation and all adversarial fixtures without implying a qualified runtime, research, or doctrinal result."
  },
  "schema_version": "logos.doctrine_mesh_specification_validation_receipt.v2",
  "receipt_id": "DM-VALIDATION-002",
  "revision_manifest_ref": "revision-manifest.yaml",
  "revision_manifest_digest": "sha256:5187ad96a294c5b6aa3dcfad7af67635ceceac562068abc6314a896dbcde2f9e",
  "payload_digest": "sha256:6fdc5507d69ed5e6cdeb0aa9b79ed6365aa6b38cce258a0649ee527ba5e15fa8",
  "validator_ref": "checks/validate_doctrine_mesh.py",
  "validator_digest": "sha256:2cb2350c2f3eb2db6c945891c19f987adf4fc1c351638fa33ad54d3c31144e60",
  "test_ref": "checks/test_validate_doctrine_mesh.py",
  "test_digest": "sha256:11d53d52992dd025b5429a9fced4453e668d6ecdc80297432342f60abde64d7d",
  "final_replay_command": "python -B docs/roadmap/logos-stewardship-architecture-buildout/revisions/doctrine-mesh-v2/checks/validate_doctrine_mesh.py --mode final",
  "test_command": "python -B docs/roadmap/logos-stewardship-architecture-buildout/revisions/doctrine-mesh-v2/checks/test_validate_doctrine_mesh.py",
  "status": "pass_artifact_specification_only",
  "validator_result": {"failure_count": 0, "audit_failures": 0, "internal_markdown_link_failures": 0, "campaign_gate_evidence_refs": 10},
  "test_result": {"status": "pass", "test_count": 21, "skipped": 0},
  "runtime_activation_authorized": false,
  "research_authorized": false,
  "mutation_performed": false,
  "observed_at": "2026-08-28T12:44:16.6547735Z",
  "receipt_digest": "sha256:f84b074f9bf97220c5f9b6b73a886f469c2cc832d670d3aded959d7ad360d7ec"
}
